train,stations
1,"[Den Haag Centraal, Delft, Schiedam Centrum, Rotterdam Centraal, Schiedam Centrum, Delft, Den Haag Centraal, Gouda, Rotterdam Alexander, Rotterdam Centraal, Rotterdam Alexander, Gouda]"
2,"[Gouda, Alphen a/d Rijn, Gouda, Den Haag Centraal, Leiden Centraal, Schiphol Airport, Leiden Centraal, Schiphol Airport]"
3,"[Haarlem, Heemstede-Aerdenhout, Leiden Centraal, Den Haag Centraal, Delft, Schiedam Centrum, Delft, Schiedam Centrum, Rotterdam Centraal, Dordrecht]"
4,"[Rotterdam Centraal, Schiedam Centrum, Delft, Den Haag Centraal, Gouda, Alphen a/d Rijn, Leiden Centraal, Alphen a/d Rijn]"
5,"[Alphen a/d Rijn, Leiden Centraal, Alphen a/d Rijn, Leiden Centraal, Heemstede-Aerdenhout, Haarlem, Heemstede-Aerdenhout, Haarlem]"
6,"[Amsterdam Amstel, Amsterdam Zuid, Amsterdam Sloterdijk, Amsterdam Zuid, Schiphol Airport, Leiden Centraal, Den Haag Centraal, Leiden Centraal]"
7,"[Amsterdam Centraal, Amsterdam Amstel, Amsterdam Centraal, Amsterdam Amstel, Amsterdam Zuid, Amsterdam Amstel, Amsterdam Zuid, Amsterdam Sloterdijk, Zaandam, Hoorn]"
score,4584.428571428571
