train,stations
1,"[Den Helder, Alkmaar, Castricum, Alkmaar, Den Helder]"
2,"[Dordrecht, Rotterdam Centraal, Schiedam Centrum, Rotterdam Centraal, Dordrecht, Rotterdam Centraal, Dordrecht, Rotterdam Centraal]"
3,"[Alphen a/d Rijn, Leiden Centraal, Den Haag Centraal, Leiden Centraal, Alphen a/d Rijn]"
4,"[Amsterdam Amstel, Amsterdam Centraal, Amsterdam Sloterdijk, Amsterdam Centraal, Amsterdam Sloterdijk, Haarlem, Heemstede-Aerdenhout, Haarlem, Beverwijk, Castricum, Beverwijk]"
5,[Amsterdam Centraal]
6,"[Delft, Schiedam Centrum, Rotterdam Centraal, Dordrecht, Rotterdam Centraal, Dordrecht, Rotterdam Centraal]"
7,"[Heemstede-Aerdenhout, Haarlem, Beverwijk, Zaandam]"
score,2569.142857142857
