train,stations
1,"[Amsterdam Amstel, Amsterdam Zuid, Schiphol Airport, Amsterdam Zuid, Schiphol Airport, Leiden Centraal, Alphen a/d Rijn, Leiden Centraal, Heemstede-Aerdenhout, Leiden Centraal, Heemstede-Aerdenhout, Haarlem]"
2,"[Den Helder, Alkmaar, Castricum, Zaandam, Castricum, Beverwijk, Haarlem, Amsterdam Sloterdijk, Amsterdam Centraal]"
3,"[Haarlem, Beverwijk, Zaandam, Hoorn, Zaandam, Amsterdam Sloterdijk, Zaandam]"
4,"[Rotterdam Alexander, Gouda, Alphen a/d Rijn, Gouda, Rotterdam Alexander, Gouda, Den Haag Centraal, Gouda]"
5,"[Delft, Den Haag Centraal, Delft, Schiedam Centrum, Rotterdam Centraal, Rotterdam Alexander, Rotterdam Centraal, Schiedam Centrum, Delft, Schiedam Centrum, Rotterdam Centraal, Dordrecht, Rotterdam Centraal, Rotterdam Alexander]"
6,"[Den Haag Centraal, Leiden Centraal, Schiphol Airport, Amsterdam Zuid, Amsterdam Amstel, Amsterdam Centraal, Amsterdam Amstel, Amsterdam Centraal, Amsterdam Sloterdijk, Amsterdam Zuid, Amsterdam Sloterdijk, Haarlem]"
7,"[Alkmaar, Hoorn, Alkmaar, Castricum, Zaandam, Beverwijk, Castricum, Alkmaar]"
score,7972.285714285714
