train,stations
1,"[Den Helder, Alkmaar, Castricum, Hoorn, Den Helder]"
2,"[Dordrecht, Rotterdam Centraal, Schiedam Centrum, Rotterdam Alexander, Dordrecht, Rotterdam Centraal, Dordrecht, Rotterdam Alexander, Dordrecht, Rotterdam Centraal, Schiedam Centrum, Schiedam Centrum]"
3,"[Alphen a/d Rijn, Leiden Centraal, Gouda, Rotterdam Alexander, Den Haag Centraal, Alphen a/d Rijn, Gouda, Leiden Centraal, Den Haag Centraal, Heemstede-Aerdenhout, Alphen a/d Rijn]"
4,"[Amsterdam Amstel, Amsterdam Centraal, Amsterdam Zuid, Schiphol Airport, Amsterdam Amstel, Amsterdam Sloterdijk, Amsterdam Centraal, Zaandam, Haarlem, Amsterdam Zuid, Amsterdam Sloterdijk, Amsterdam Amstel]"
5,"[Amsterdam Centraal, Amsterdam Sloterdijk, Amsterdam Amstel, Amsterdam Zuid, Amsterdam Centraal, Amsterdam Amstel, Amsterdam Sloterdijk, Amsterdam Zuid, Haarlem, Amsterdam Zuid, Haarlem, Heemstede-Aerdenhout, Amsterdam Sloterdijk, Beverwijk, Castricum, Haarlem]"
6,"[Delft, Schiedam Centrum, Den Haag Centraal, Leiden Centraal, Delft, Gouda, Rotterdam Alexander, Den Haag Centraal, Rotterdam Alexander, Rotterdam Centraal]"
7,"[Heemstede-Aerdenhout, Haarlem, Leiden Centraal, Schiphol Airport, Alphen a/d Rijn, Alphen a/d Rijn, Den Haag Centraal, Gouda, Leiden Centraal, Gouda, Alphen a/d Rijn, Den Haag Centraal]"
score,8762.142857142859
