train,stations
1,"[Rotterdam Alexander, Rotterdam Centraal, Dordrecht, Rotterdam Centraal, Schiedam Centrum, Delft, Den Haag Centraal, Delft, Schiedam Centrum, Delft, Schiedam Centrum, Delft]"
2,"[Delft, Schiedam Centrum, Delft, Den Haag Centraal, Leiden Centraal, Heemstede-Aerdenhout, Leiden Centraal, Alphen a/d Rijn, Leiden Centraal, Schiphol Airport, Amsterdam Zuid]"
3,"[Amsterdam Sloterdijk, Amsterdam Zuid, Schiphol Airport, Amsterdam Zuid, Amsterdam Amstel, Amsterdam Zuid, Amsterdam Amstel, Amsterdam Centraal, Amsterdam Sloterdijk, Amsterdam Centraal, Amsterdam Sloterdijk, Haarlem, Beverwijk]"
4,"[Heemstede-Aerdenhout, Leiden Centraal, Schiphol Airport, Amsterdam Zuid, Schiphol Airport, Leiden Centraal, Heemstede-Aerdenhout, Haarlem, Beverwijk, Zaandam]"
5,"[Gouda, Rotterdam Alexander, Rotterdam Centraal, Dordrecht, Rotterdam Centraal, Dordrecht, Rotterdam Centraal, Dordrecht, Rotterdam Centraal]"
6,"[Alkmaar, Hoorn, Zaandam, Castricum, Zaandam, Hoorn]"
7,"[Dordrecht, Rotterdam Centraal, Schiedam Centrum, Rotterdam Centraal, Rotterdam Alexander, Gouda, Rotterdam Alexander, Gouda, Den Haag Centraal, Leiden Centraal, Alphen a/d Rijn]"
score,5130.142857142857
