train,stations
1,"[Heemstede-Aerdenhout, Haarlem, Amsterdam Sloterdijk, Amsterdam Centraal, Amsterdam Amstel, Amsterdam Zuid, Schiphol Airport, Leiden Centraal, Alphen a/d Rijn, Gouda, Den Haag Centraal]"
2,"[Beverwijk, Haarlem, Amsterdam Sloterdijk, Zaandam, Castricum, Alkmaar, Hoorn, Alkmaar]"
3,"[Schiedam Centrum, Rotterdam Centraal, Dordrecht, Rotterdam Centraal, Rotterdam Alexander, Gouda, Den Haag Centraal, Delft, Den Haag Centraal, Leiden Centraal]"
4,"[Amsterdam Amstel, Amsterdam Centraal, Amsterdam Sloterdijk, Amsterdam Zuid, Schiphol Airport, Leiden Centraal, Den Haag Centraal, Gouda, Rotterdam Alexander, Rotterdam Centraal, Schiedam Centrum, Delft]"
5,"[Zaandam, Castricum, Alkmaar, Den Helder, Alkmaar, Hoorn]"
6,"[Alkmaar, Castricum, Zaandam, Beverwijk, Haarlem, Amsterdam Sloterdijk, Zaandam, Hoorn]"
7,"[Haarlem, Beverwijk, Castricum, Alkmaar, Den Helder, Alkmaar]"
score,5850.428571428571
