train,stations
1,"[Amsterdam Zuid, Schiphol Airport, Leiden Centraal, Alphen a/d Rijn, Gouda, Rotterdam Alexander, Rotterdam Centraal, Rotterdam Alexander, Gouda, Alphen a/d Rijn]"
2,"[Amsterdam Centraal, Amsterdam Sloterdijk, Zaandam, Beverwijk, Haarlem, Heemstede-Aerdenhout, Leiden Centraal, Den Haag Centraal, Delft, Schiedam Centrum, Rotterdam Centraal]"
3,"[Alphen a/d Rijn, Gouda, Rotterdam Alexander, Rotterdam Centraal, Dordrecht, Rotterdam Centraal, Schiedam Centrum, Delft, Den Haag Centraal, Leiden Centraal]"
4,"[Delft, Schiedam Centrum, Rotterdam Centraal, Dordrecht, Rotterdam Centraal, Rotterdam Alexander, Rotterdam Centraal, Schiedam Centrum, Delft, Den Haag Centraal, Gouda, Rotterdam Alexander]"
5,"[Dordrecht, Rotterdam Centraal, Rotterdam Alexander, Gouda, Alphen a/d Rijn, Leiden Centraal, Den Haag Centraal, Delft, Schiedam Centrum, Rotterdam Centraal]"
6,"[Amsterdam Centraal, Amsterdam Amstel, Amsterdam Zuid, Amsterdam Sloterdijk, Zaandam, Hoorn, Alkmaar, Castricum, Alkmaar]"
7,"[Delft, Den Haag Centraal, Leiden Centraal, Alphen a/d Rijn, Gouda, Den Haag Centraal, Delft, Schiedam Centrum, Rotterdam Centraal, Rotterdam Alexander, Rotterdam Centraal]"
score,4779.0
