train,stations
1,"[Rotterdam Centraal, Dordrecht, Rotterdam Centraal, Schiedam Centrum, Delft, Den Haag Centraal, Gouda, Alphen a/d Rijn, Leiden Centraal]"
2,"[Alkmaar, Den Helder, Alkmaar, Castricum, Zaandam, Amsterdam Sloterdijk, Amsterdam Centraal, Amsterdam Amstel]"
3,"[Alphen a/d Rijn, Gouda, Den Haag Centraal, Delft, Schiedam Centrum, Rotterdam Centraal, Rotterdam Alexander, Rotterdam Centraal, Rotterdam Alexander, Gouda, Rotterdam Alexander, Rotterdam Centraal]"
4,"[Zaandam, Beverwijk, Haarlem, Heemstede-Aerdenhout, Leiden Centraal, Heemstede-Aerdenhout, Haarlem, Beverwijk, Zaandam]"
5,"[Zaandam, Hoorn, Alkmaar, Castricum, Alkmaar, Hoorn, Zaandam]"
6,"[Heemstede-Aerdenhout, Leiden Centraal, Den Haag Centraal, Leiden Centraal, Schiphol Airport, Amsterdam Zuid, Amsterdam Amstel, Amsterdam Zuid, Schiphol Airport, Leiden Centraal, Alphen a/d Rijn]"
7,"[Amsterdam Amstel, Amsterdam Centraal, Amsterdam Sloterdijk, Haarlem, Amsterdam Sloterdijk, Amsterdam Zuid, Amsterdam Sloterdijk, Zaandam, Castricum, Beverwijk, Castricum]"
score,0
