train,stations
1,"[Castricum, Beverwijk, Haarlem, Amsterdam Sloterdijk, Zaandam, Hoorn, Alkmaar]"
2,"[Amsterdam Sloterdijk, Haarlem, Heemstede-Aerdenhout, Leiden Centraal, Den Haag Centraal, Delft, Schiedam Centrum, Rotterdam Centraal, Dordrecht, Rotterdam Centraal, Rotterdam Alexander, Gouda]"
3,"[Schiedam Centrum, Delft, Den Haag Centraal, Gouda, Alphen a/d Rijn, Leiden Centraal, Schiphol Airport, Amsterdam Zuid, Amsterdam Amstel, Amsterdam Centraal, Amsterdam Sloterdijk]"
4,"[Alkmaar, Castricum, Zaandam, Amsterdam Sloterdijk, Haarlem, Beverwijk, Zaandam, Castricum, Alkmaar]"
5,"[Rotterdam Centraal, Schiedam Centrum, Delft, Den Haag Centraal, Leiden Centraal, Alphen a/d Rijn, Gouda, Rotterdam Alexander, Rotterdam Centraal, Dordrecht]"
6,"[Den Helder, Alkmaar, Hoorn, Zaandam, Beverwijk]"
7,"[Amsterdam Sloterdijk, Amsterdam Centraal, Amsterdam Amstel, Amsterdam Zuid, Schiphol Airport, Leiden Centraal, Heemstede-Aerdenhout, Haarlem, Beverwijk, Castricum, Alkmaar]"
score,7836.714285714286
