train,stations
1,"[Den Haag Centraal, Delft, Schiedam Centrum, Rotterdam Centraal, Schiedam Centrum, Delft, Den Haag Centraal, Gouda, Rotterdam Alexander, Rotterdam Centraal, Rotterdam Alexander, Gouda]"
2,"[Gouda, Alphen a/d Rijn, Gouda, Rotterdam Alexander, Gouda, Alphen a/d Rijn, Leiden Centraal, Heemstede-Aerdenhout]"
3,"[Haarlem, Heemstede-Aerdenhout, Leiden Centraal, Schiphol Airport, Amsterdam Zuid, Amsterdam Sloterdijk, Amsterdam Zuid, Amsterdam Sloterdijk]"
4,"[Rotterdam Centraal, Dordrecht, Rotterdam Centraal, Schiedam Centrum, Rotterdam Centraal, Schiedam Centrum, Rotterdam Centraal, Schiedam Centrum, Rotterdam Centraal]"
5,"[Alphen a/d Rijn, Leiden Centraal, Alphen a/d Rijn, Gouda, Alphen a/d Rijn, Gouda, Rotterdam Alexander, Rotterdam Centraal]"
6,"[Amsterdam Amstel, Amsterdam Zuid, Amsterdam Amstel, Amsterdam Zuid, Amsterdam Sloterdijk, Amsterdam Zuid, Amsterdam Sloterdijk, Haarlem, Amsterdam Sloterdijk]"
7,"[Amsterdam Centraal, Amsterdam Amstel, Amsterdam Centraal, Amsterdam Amstel, Amsterdam Zuid, Amsterdam Sloterdijk, Zaandam, Castricum, Alkmaar]"
score,4412.857142857143
