train,stations
1,"[Amsterdam Sloterdijk, Amsterdam Centraal, Amsterdam Sloterdijk, Zaandam, Amsterdam Sloterdijk, Haarlem, Heemstede-Aerdenhout, Haarlem, Amsterdam Sloterdijk, Amsterdam Zuid, Schiphol Airport, Amsterdam Zuid, Amsterdam Amstel, Amsterdam Centraal, Amsterdam Amstel]"
2,"[Leiden Centraal, Den Haag Centraal, Leiden Centraal, Heemstede-Aerdenhout, Leiden Centraal, Alphen a/d Rijn, Leiden Centraal, Schiphol Airport, Leiden Centraal]"
3,"[Zaandam, Castricum, Alkmaar, Castricum, Zaandam, Beverwijk, Castricum, Beverwijk, Haarlem]"
4,"[Alkmaar, Hoorn, Alkmaar, Den Helder, Alkmaar]"
5,"[Amsterdam Zuid, Amsterdam Sloterdijk, Amsterdam Zuid, Amsterdam Sloterdijk, Haarlem, Beverwijk, Zaandam]"
6,"[Beverwijk, Castricum, Zaandam, Amsterdam Sloterdijk, Haarlem, Heemstede-Aerdenhout, Leiden Centraal]"
7,"[Castricum, Beverwijk, Haarlem, Amsterdam Sloterdijk, Amsterdam Zuid, Schiphol Airport, Leiden Centraal, Schiphol Airport]"
score,5128.142857142857
