train,stations
1,"[Heemstede-Aerdenhout, Haarlem, Beverwijk, Zaandam, Castricum, Alkmaar, Den Helder]"
2,"[Amsterdam Sloterdijk, Zaandam, Hoorn, Alkmaar, Castricum, Beverwijk, Zaandam, Castricum]"
3,"[Dordrecht, Rotterdam Centraal, Rotterdam Alexander, Gouda, Alphen a/d Rijn, Leiden Centraal, Schiphol Airport, Amsterdam Zuid, Amsterdam Sloterdijk, Amsterdam Centraal, Amsterdam Amstel]"
4,"[Delft, Den Haag Centraal, Gouda, Rotterdam Alexander, Rotterdam Centraal, Dordrecht, Rotterdam Centraal, Schiedam Centrum, Delft, Schiedam Centrum, Delft, Schiedam Centrum]"
5,"[Beverwijk, Zaandam, Castricum, Alkmaar, Hoorn, Zaandam]"
6,"[Gouda, Den Haag Centraal, Delft, Schiedam Centrum, Rotterdam Centraal, Dordrecht, Rotterdam Centraal, Rotterdam Alexander, Gouda, Alphen a/d Rijn]"
7,"[Dordrecht, Rotterdam Centraal, Schiedam Centrum, Delft, Den Haag Centraal, Gouda, Rotterdam Alexander, Rotterdam Centraal, Rotterdam Alexander, Rotterdam Centraal, Dordrecht]"
score,4596.428571428571
