train,stations
1,"[Leiden Centraal, Den Haag Centraal, Leiden Centraal, Den Haag Centraal, Gouda, Den Haag Centraal, Delft, Den Haag Centraal, Delft, Schiedam Centrum]"
2,"[Amsterdam Sloterdijk, Haarlem, Amsterdam Sloterdijk, Amsterdam Zuid, Amsterdam Sloterdijk, Haarlem, Heemstede-Aerdenhout, Haarlem, Amsterdam Sloterdijk, Amsterdam Centraal, Amsterdam Sloterdijk, Amsterdam Zuid]"
3,"[Dordrecht, Rotterdam Centraal, Schiedam Centrum, Rotterdam Centraal, Schiedam Centrum, Rotterdam Centraal, Rotterdam Alexander, Rotterdam Centraal, Schiedam Centrum, Delft, Den Haag Centraal, Leiden Centraal, Schiphol Airport, Amsterdam Zuid]"
4,"[Amsterdam Zuid, Amsterdam Sloterdijk, Zaandam, Amsterdam Sloterdijk, Amsterdam Zuid, Schiphol Airport, Leiden Centraal, Alphen a/d Rijn, Gouda, Alphen a/d Rijn]"
5,"[Beverwijk, Zaandam, Beverwijk, Castricum, Beverwijk, Castricum, Zaandam, Castricum]"
6,"[Amsterdam Sloterdijk, Amsterdam Zuid, Amsterdam Amstel, Amsterdam Centraal, Amsterdam Amstel, Amsterdam Zuid, Amsterdam Sloterdijk, Amsterdam Zuid, Amsterdam Amstel, Amsterdam Centraal, Amsterdam Amstel, Amsterdam Zuid]"
7,"[Castricum, Alkmaar, Hoorn, Alkmaar, Hoorn, Zaandam]"
score,6355.142857142857
