train,stations
1,"[Den Helder, Alkmaar, Castricum, Alkmaar, Hoorn, Alkmaar]"
2,"[Dordrecht, Rotterdam Centraal, Schiedam Centrum, Rotterdam Centraal, Rotterdam Alexander, Rotterdam Centraal, Dordrecht, Dordrecht, Dordrecht, Dordrecht]"
3,"[Alphen a/d Rijn, Leiden Centraal, Den Haag Centraal, Leiden Centraal, Heemstede-Aerdenhout, Haarlem, Heemstede-Aerdenhout, Leiden Centraal, Alphen a/d Rijn, Gouda, Rotterdam Alexander]"
4,"[Amsterdam Amstel, Amsterdam Centraal, Amsterdam Sloterdijk, Amsterdam Centraal, Amsterdam Amstel, Amsterdam Zuid, Schiphol Airport, Amsterdam Zuid, Amsterdam Amstel, Amsterdam Amstel, Amsterdam Amstel, Amsterdam Amstel, Amsterdam Amstel, Amsterdam Amstel, Amsterdam Amstel]"
5,"[Amsterdam Centraal, Amsterdam Amstel, Amsterdam Zuid, Amsterdam Sloterdijk, Zaandam, Castricum, Zaandam, Beverwijk, Castricum, Beverwijk]"
6,"[Delft, Schiedam Centrum, Delft, Den Haag Centraal, Delft, Delft, Delft, Delft, Delft, Delft, Delft]"
7,"[Heemstede-Aerdenhout, Haarlem, Amsterdam Sloterdijk, Haarlem, Beverwijk, Zaandam, Hoorn]"
score,7091.428571428571
